<!ELEMENT doc (variable-list, source-list, render-list)>

<!ELEMENT variable-list (variable+)>
<!ELEMENT variable (#PCDATA)>
    <!ATTLIST variable key CDATA #REQUIRED>
    <!ATTLIST variable eval CDATA "n">
    <!ATTLIST variable keyword CDATA "default">

<!ELEMENT title1 (#PCDATA)>
<!ELEMENT title2 (#PCDATA)>
<!ELEMENT title3 (#PCDATA)>

<!ELEMENT source-list (source+)>
<!ELEMENT source EMPTY>
    <!ATTLIST source key CDATA #REQUIRED>
    <!ATTLIST source type CDATA "">

<!ELEMENT render-list (render+)>
<!ELEMENT render (title1?, title2?, title3?, render-source+)>
    <!ATTLIST render type CDATA #REQUIRED>
    <!ATTLIST render compact CDATA "n">
    <!ATTLIST render pretty CDATA "n">
    <!ATTLIST render file CDATA "">
<!ELEMENT render-source EMPTY>
    <!ATTLIST render-source key CDATA #REQUIRED>
    <!ATTLIST render-source source CDATA "">
    <!ATTLIST render-source file CDATA "">
    <!ATTLIST render-source menu CDATA "">
